{
  "entries": [
    {
      "handler_expression": "Sprite_DashBeeHive",
      "handler_label": "Sprite_DashBeeHive",
      "pointer_entry_file_offset": 985907,
      "source_comment": "0x79 - $DC5B Good bee / Normal bee",
      "source_comment_sprite_type_id": 121,
      "source_description": "Good bee / Normal bee",
      "source_handler_address_annotation": "$DC5B",
      "source_line": 80,
      "source_revision": "347c23f9fc019c72d32da537c9cb235f468d021d",
      "sprite_type_id": 121,
      "table_index": 0
    },
    {
      "handler_expression": "Sprite_Agahnim",
      "handler_label": "Sprite_Agahnim",
      "pointer_entry_file_offset": 985909,
      "source_comment": "0x7A - $D330 Agahnim.",
      "source_comment_sprite_type_id": 122,
      "source_description": "Agahnim.",
      "source_handler_address_annotation": "$D330",
      "source_line": 81,
      "source_revision": "347c23f9fc019c72d32da537c9cb235f468d021d",
      "sprite_type_id": 122,
      "table_index": 1
    },
    {
      "handler_expression": "Sprite_EnergyBall",
      "handler_label": "Sprite_EnergyBall",
      "pointer_entry_file_offset": 985911,
      "source_comment": "0x7B - $DA42 Agahnim energy blasts",
      "source_comment_sprite_type_id": 123,
      "source_description": "Agahnim energy blasts",
      "source_handler_address_annotation": "$DA42",
      "source_line": 82,
      "source_revision": "347c23f9fc019c72d32da537c9cb235f468d021d",
      "sprite_type_id": 123,
      "table_index": 2
    },
    {
      "handler_expression": "Sprite_GreenStalfos",
      "handler_label": "Sprite_GreenStalfos",
      "pointer_entry_file_offset": 985913,
      "source_comment": "0x7C - $D299 Green Stalfos",
      "source_comment_sprite_type_id": 124,
      "source_description": "Green Stalfos",
      "source_handler_address_annotation": "$D299",
      "source_line": 83,
      "source_revision": "347c23f9fc019c72d32da537c9cb235f468d021d",
      "sprite_type_id": 124,
      "table_index": 3
    },
    {
      "handler_expression": "Sprite_SpikeTrap",
      "handler_label": "Sprite_SpikeTrap",
      "pointer_entry_file_offset": 985915,
      "source_comment": "0x7D - $D01A Spike Traps",
      "source_comment_sprite_type_id": 125,
      "source_description": "Spike Traps",
      "source_handler_address_annotation": "$D01A",
      "source_line": 84,
      "source_revision": "347c23f9fc019c72d32da537c9cb235f468d021d",
      "sprite_type_id": 125,
      "table_index": 4
    },
    {
      "handler_expression": "Sprite_GuruguruBar",
      "handler_label": "Sprite_GuruguruBar",
      "pointer_entry_file_offset": 985917,
      "source_comment": "0x7E - $CF47 Swinging Fireball Chains",
      "source_comment_sprite_type_id": 126,
      "source_description": "Swinging Fireball Chains",
      "source_handler_address_annotation": "$CF47",
      "source_line": 85,
      "source_revision": "347c23f9fc019c72d32da537c9cb235f468d021d",
      "sprite_type_id": 126,
      "table_index": 5
    },
    {
      "handler_expression": "Sprite_GuruguruBar",
      "handler_label": "Sprite_GuruguruBar",
      "pointer_entry_file_offset": 985919,
      "source_comment": "0x7F - $D01A Swinging Fireball Chains",
      "source_comment_sprite_type_id": 127,
      "source_description": "Swinging Fireball Chains",
      "source_handler_address_annotation": "$D01A",
      "source_line": 86,
      "source_revision": "347c23f9fc019c72d32da537c9cb235f468d021d",
      "sprite_type_id": 127,
      "table_index": 6
    },
    {
      "handler_expression": "Sprite_Winder",
      "handler_label": "Sprite_Winder",
      "pointer_entry_file_offset": 985921,
      "source_comment": "0x80 - $D1D1 Winder (wandering fireball chain0",
      "source_comment_sprite_type_id": 128,
      "source_description": "Winder (wandering fireball chain0",
      "source_handler_address_annotation": "$D1D1",
      "source_line": 87,
      "source_revision": "347c23f9fc019c72d32da537c9cb235f468d021d",
      "sprite_type_id": 128,
      "table_index": 7
    },
    {
      "handler_expression": "Sprite_Hover",
      "handler_label": "Sprite_Hover",
      "pointer_entry_file_offset": 985923,
      "source_comment": "0x81 - $CC02 Hover",
      "source_comment_sprite_type_id": 129,
      "source_description": "Hover",
      "source_handler_address_annotation": "$CC02",
      "source_line": 88,
      "source_revision": "347c23f9fc019c72d32da537c9cb235f468d021d",
      "sprite_type_id": 129,
      "table_index": 8
    },
    {
      "handler_expression": "Sprite_AntiFairyGroup",
      "handler_label": "Sprite_AntiFairyGroup",
      "pointer_entry_file_offset": 985925,
      "source_comment": "0x82 - $CB97 Swirling Fire Fairys",
      "source_comment_sprite_type_id": 130,
      "source_description": "Swirling Fire Fairys",
      "source_handler_address_annotation": "$CB97",
      "source_line": 89,
      "source_revision": "347c23f9fc019c72d32da537c9cb235f468d021d",
      "sprite_type_id": 130,
      "table_index": 9
    },
    {
      "handler_expression": "Sprite_Eyegore",
      "handler_label": "Sprite_Eyegore",
      "pointer_entry_file_offset": 985927,
      "source_comment": "0x83 - $C79B Green Eyegore",
      "source_comment_sprite_type_id": 131,
      "source_description": "Green Eyegore",
      "source_handler_address_annotation": "$C79B",
      "source_line": 90,
      "source_revision": "347c23f9fc019c72d32da537c9cb235f468d021d",
      "sprite_type_id": 131,
      "table_index": 10
    },
    {
      "handler_expression": "Sprite_Eyegore",
      "handler_label": "Sprite_Eyegore",
      "pointer_entry_file_offset": 985929,
      "source_comment": "0x84 - $C79B Red Eyegore",
      "source_comment_sprite_type_id": 132,
      "source_description": "Red Eyegore",
      "source_handler_address_annotation": "$C79B",
      "source_line": 91,
      "source_revision": "347c23f9fc019c72d32da537c9cb235f468d021d",
      "sprite_type_id": 132,
      "table_index": 11
    },
    {
      "handler_expression": "Sprite_YellowStalfos",
      "handler_label": "Sprite_YellowStalfos",
      "pointer_entry_file_offset": 985931,
      "source_comment": "0x85 - $C37F Yellow Stalfos",
      "source_comment_sprite_type_id": 133,
      "source_description": "Yellow Stalfos",
      "source_handler_address_annotation": "$C37F",
      "source_line": 92,
      "source_revision": "347c23f9fc019c72d32da537c9cb235f468d021d",
      "sprite_type_id": 133,
      "table_index": 12
    },
    {
      "handler_expression": "Sprite_Kodondo",
      "handler_label": "Sprite_Kodondo",
      "pointer_entry_file_offset": 985933,
      "source_comment": "0x86 - $C103 Kodondo",
      "source_comment_sprite_type_id": 134,
      "source_description": "Kodondo",
      "source_handler_address_annotation": "$C103",
      "source_line": 93,
      "source_revision": "347c23f9fc019c72d32da537c9cb235f468d021d",
      "sprite_type_id": 134,
      "table_index": 13
    },
    {
      "handler_expression": "Sprite_Flame",
      "handler_label": "Sprite_Flame",
      "pointer_entry_file_offset": 985935,
      "source_comment": "0x87 - $C274 Flame (from Kodondo and Fire Rod)",
      "source_comment_sprite_type_id": 135,
      "source_description": "Flame (from Kodondo and Fire Rod)",
      "source_handler_address_annotation": "$C274",
      "source_line": 94,
      "source_revision": "347c23f9fc019c72d32da537c9cb235f468d021d",
      "sprite_type_id": 135,
      "table_index": 14
    },
    {
      "handler_expression": "Sprite_Mothula",
      "handler_label": "Sprite_Mothula",
      "pointer_entry_file_offset": 985937,
      "source_comment": "0x88 - $42BE Mothula",
      "source_comment_sprite_type_id": 136,
      "source_description": "Mothula",
      "source_handler_address_annotation": "$42BE",
      "source_line": 95,
      "source_revision": "347c23f9fc019c72d32da537c9cb235f468d021d",
      "sprite_type_id": 136,
      "table_index": 15
    },
    {
      "handler_expression": "Sprite_MothulaBeam",
      "handler_label": "Sprite_MothulaBeam",
      "pointer_entry_file_offset": 985939,
      "source_comment": "0x89 - $BB42 Mothula beam",
      "source_comment_sprite_type_id": 137,
      "source_description": "Mothula beam",
      "source_handler_address_annotation": "$BB42",
      "source_line": 96,
      "source_revision": "347c23f9fc019c72d32da537c9cb235f468d021d",
      "sprite_type_id": 137,
      "table_index": 16
    },
    {
      "handler_expression": "Sprite_SpikeBlock",
      "handler_label": "Sprite_SpikeBlock",
      "pointer_entry_file_offset": 985941,
      "source_comment": "0x8A - $BCE8 Moving spike blocks",
      "source_comment_sprite_type_id": 138,
      "source_description": "Moving spike blocks",
      "source_handler_address_annotation": "$BCE8",
      "source_line": 97,
      "source_revision": "347c23f9fc019c72d32da537c9cb235f468d021d",
      "sprite_type_id": 138,
      "table_index": 17
    },
    {
      "handler_expression": "Sprite_Gibdo",
      "handler_label": "Sprite_Gibdo",
      "pointer_entry_file_offset": 985943,
      "source_comment": "0x8B - $A9B9 Gibdo",
      "source_comment_sprite_type_id": 139,
      "source_description": "Gibdo",
      "source_handler_address_annotation": "$A9B9",
      "source_line": 98,
      "source_revision": "347c23f9fc019c72d32da537c9cb235f468d021d",
      "sprite_type_id": 139,
      "table_index": 18
    },
    {
      "handler_expression": "Sprite_Arrghus",
      "handler_label": "Sprite_Arrghus",
      "pointer_entry_file_offset": 985945,
      "source_comment": "0x8C - $B433 Arrghus",
      "source_comment_sprite_type_id": 140,
      "source_description": "Arrghus",
      "source_handler_address_annotation": "$B433",
      "source_line": 99,
      "source_revision": "347c23f9fc019c72d32da537c9cb235f468d021d",
      "sprite_type_id": 140,
      "table_index": 19
    },
    {
      "handler_expression": "Sprite_Arrghi",
      "handler_label": "Sprite_Arrghi",